{
  "configVersion": 1,
  "server": {
    "host": "127.0.0.1",
    "port": 8123,
    "webRoot": "public"
  },
  "scan": {
    "basedir": "batches",
    "out": "batches-index.json",
    "ignore": [],
    "env": null
  },
  "runType": "dev",
  "audit": false,
  "tenants": {},
  "urls": {
    "data": "report-validation-data.json",
    "ignore": "ignore-config-by-platform.json",
    "batches": "batches-index.json",
    "scan": "/scan",
    "help": "batch-help.json",
    "defaultDataMode": "default"
  },
  "ui": {
    "lang": "zh-CN",
    "theme": "light",
    "sidebarMode": "combined",
    "sidebarWidth": 280,
    "reportCatDefault": null,
    "batchDockSide": "left",
    "progressBarStyle": "status"
  },
  "features": {
    "uncomparedXpath": true,
    "uncomparedItems": true,
    "uncomparedCsv": true,
    "logs": true,
    "conversionRule": true,
    "validationRule": true,
    "excelMapping": true,
    "sourceFilter": true,
    "modalRules": true,
    "columnHover": true,
    "sidebarSearch": true,
    "sidebarTradeId": true,
    "compare": true,
    "healthOverview": true,
    "globalSearch": true,
    "keyboardShortcuts": true,
    "modalPrints": true,
    "recentBatches": true,
    "batchHelp": true,
    "revealPath": true,
    "descriptionEx": true,
    "clearLocalCache": true,
    "homeButton": true
  },
  "limits": {
    "pageSize": 20,
    "pageSizeOptions": [
      10,
      20,
      50
    ],
    "sidebarPageSize": 8,
    "msgPageSize": 20,
    "globalSearchLimit": 200,
    "descExPageSize": 5,
    "ignoreMgrPageSize": 10
  },
  "batches": {
    "recentCount": 5,
    "pageSize": 8,
    "listMode": "lazy",
    "detailMode": "quick",
    "panelWidth": 320
  },
  "columns": {
    "default": {
      "channel": true,
      "source": true,
      "field": true,
      "userTag": true,
      "type": false,
      "ctxs": false,
      "eoEl": false,
      "aoEl": false,
      "eoCvtEl": false,
      "aoCvtEl": false,
      "vdtEl": false,
      "eoUnconverted": false,
      "eo": true,
      "aoUnconverted": false,
      "ao": true,
      "result": true,
      "remarks": false
    },
    "labels": {
      "aoEl": { "zh-CN": "表达式 (CMP-R)", "zh-HK": "表達式 (CMP-R)", "en": "Expression (CMP-R)" },
      "eoEl": { "zh-CN": "表达式 (CMP-L)", "zh-HK": "表達式 (CMP-L)", "en": "Expression (CMP-L)" },
      "eoCvtEl": { "zh-CN": "表达式 (CVT-L)", "zh-HK": "表達式 (CVT-L)", "en": "Expression (CVT-L)" },
      "aoCvtEl": { "zh-CN": "表达式 (CVT-R)", "zh-HK": "表達式 (CVT-R)", "en": "Expression (CVT-R)" },
      "vdtEl": { "zh-CN": "表达式 (VDT)", "zh-HK": "表達式 (VDT)", "en": "Expression (VDT)" },
      "eoUnconverted": { "zh-CN": "期望值 (EO-U)", "zh-HK": "期望值 (EO-U)", "en": "Expected (EO-U)" },
      "aoUnconverted": { "zh-CN": "期望值 (AO-U)", "zh-HK": "期望值 (AO-U)", "en": "Expected (AO-U)" }
    },
    "selector": {
      "aoEl": true,
      "eoEl": true,
      "eoCvtEl": true,
      "aoCvtEl": true,
      "vdtEl": true,
      "eoUnconverted": true,
      "aoUnconverted": true,
      "userTag": true,
      "type": true
    },
    "tag": false,
    "widths": {
      "channel": { "def": 110, "min": 80, "max": 280, "resizable": false },
      "source": { "def": 110, "min": 80, "max": 280, "resizable": false },
      "field": { "def": 150, "min": 80, "max": 420 },
      "userTag": { "def": 110, "min": 80, "max": 280, "resizable": false },
      "eoEl": { "def": 200, "min": 120, "max": 600 },
      "aoEl": { "def": 200, "min": 120, "max": 600 },
      "eoCvtEl": { "def": 200, "min": 120, "max": 600 },
      "aoCvtEl": { "def": 200, "min": 120, "max": 600 },
      "vdtEl": { "def": 200, "min": 120, "max": 600 },
      "type": { "def": 110, "min": 80, "max": 240, "resizable": false },
      "ctxs": { "def": 260, "min": 140, "max": 560 },
      "eoUnconverted": { "def": 200, "min": 120, "max": 600 },
      "eo": { "def": 240, "min": 120, "max": 600 },
      "aoUnconverted": { "def": 200, "min": 120, "max": 600 },
      "ao": { "def": 240, "min": 120, "max": 600 },
      "result": { "def": 100, "min": 80, "max": 240 },
      "remarks": { "def": 200, "min": 120, "max": 600 }
    },
    "userTag": {
      "raw": false,
      "labels": {
        "contextAssertion": { "zh-CN": "上下文断言", "zh-HK": "上下文斷言", "en": "Context Assertion" },
        "productAssertion": { "zh-CN": "产品断言", "zh-HK": "產品斷言", "en": "Product Assertion" },
        "platformAssertion": { "zh-CN": "平台断言", "zh-HK": "平台斷言", "en": "Platform Assertion" }
      }
    }
  }
}
